text,timestamp,username,link,link_id,parent_id,id,subreddit_id,moderation,year,word_count,Sensitive Group,Classification,clean_text,custom_topic,Topic_Words,Final Topic,Final Topic Name,Topic Num,Reddit Title
"Don't worry, SPF has your IP address now, LW will visit you shortly to let you ""feel"" his leadership.",15/4/2022 13:22,jypt98,/r/SingaporeRaw/comments/u44hkk/when_did_our_mainstream_media_become_north_korean/i4tupqr/,t3_u44hkk,t1_i4ttppv,i4tupqr,t5_xnx04,"{'controversiality': 0, 'collapsed_reason_code': None, 'collapsed': False, 'collapsed_reason': None}",2022,19,No,Toxic 3,dont worry spf ip address lw visit shortly let feel leadership,-1,"singapores, malaysians, chinese, malaysian",1.0,Race,0.0,when did our mainstream media become north korean
Rapist: She started pulling off my clothes first!,18/3/2022 6:36,throwaway29u82,/r/singapore/comments/tgaofa/on_tiktok_anonymous_accounts_seek_to_sway_views/i14gnkq/,t3_tgaofa,t1_i111qn8,i14gnkq,t5_2qh8c,"{'controversiality': 0, 'collapsed_reason_code': None, 'collapsed': False, 'collapsed_reason': None}",2022,8,No,Toxic 3,rapist started pulling clothes first,-1,"singapores, malaysians, chinese, malaysian",1.0,Race,0.0,on tiktok anonymous accounts seek to sway views
"next time if i want to murder someone, I can just do it under the pretext of drink driving. literally retarded laws",24/12/2021 6:57,ssepaulette,/r/singapore/comments/rne6wt/accident_at_junction_of_tampines_ave_1_and/hps75jn/,t3_rne6wt,t1_hprv7d6,hps75jn,t5_2qh8c,"{'collapsed_reason_code': None, 'collapsed_reason': None, 'collapsed': False, 'controversiality': 0}",2021,22,No,Toxic 3,next time want murder someone pretext drink driving literally retarded laws,-1,"singapores, malaysians, chinese, malaysian",1.0,Race,0.0,accident at junction of tampines ave 1 and
"Cheaters deserves to die, I shall be the first martyr s",31/7/2021 3:25,MUPleasFlyAgain,/r/singapore/comments/oul9fc/there_are_quite_many_sia_girls_in_ktvs_singapore/h75wyvk/,t3_oul9fc,t1_h75uojz,h75wyvk,t5_2qh8c,"{'collapsed_reason_code': None, 'collapsed_reason': None, 'collapsed': False, 'controversiality': 0}",2021,11,No,Toxic 3,cheaters deserves die shall first martyr,-1,"singapores, malaysians, chinese, malaysian",1.0,Race,0.0,there are quite many sia girls in ktvs singapore
"Then get off reddit and do something about it. Go assassinate their general or something. Or even better, since you don't condone murder go use your talk no jutsu to convince their military to stand down.",2/1/2021 7:58,deioped,/r/singapore/comments/l9vmuz/singapore_expresses_grave_concern_over_myanmars/glkripe/,t3_l9vmuz,t1_glkl5l0,glkripe,t5_2qh8c,"{'collapsed_reason_code': None, 'collapsed_reason': None, 'collapsed': False, 'controversiality': 0}",2021,36,No,Toxic 3,get reddit something go assassinate general something even better since dont condone murder go use talk jutsu convince military stand,-1,"singapores, malaysians, chinese, malaysian",1.0,Race,0.0,singapore expresses grave concern over myanmars
need them die faster sorry b4 ww3 breaks out,28/6/2022 1:26,ALilBitter,/r/SingaporeRaw/comments/vlsvdh/over_60_per_cent_of_singaporeans_malaysians/ie01k2y/,t3_vlsvdh,t1_idxmzpw,ie01k2y,t5_xnx04,"{'controversiality': 0, 'collapsed_reason_code': None, 'collapsed': False, 'collapsed_reason': None}",2022,9,No,Toxic 3,need die faster sorry b4 ww3 breaks,-1,"singapores, malaysians, chinese, malaysian",1.0,Race,0.0,over 60 per cent of singaporeans malaysians
Run around and slashing wedding guests in open air carpark better,31/5/2022 13:48,deathisnodisgrace666,/r/SingaporeRaw/comments/v1gole/resident_ramesh_erramalli_given_stern_warning_for/ianuu8m/,t3_v1gole,t1_ian700b,ianuu8m,t5_xnx04,"{'controversiality': 1, 'collapsed_reason_code': None, 'collapsed': False, 'collapsed_reason': None}",2022,11,No,Toxic 3,run around slashing wedding guests open air carpark better,-1,"singapores, malaysians, chinese, malaysian",1.0,Race,0.0,resident ramesh erramalli given stern warning for
do you give therapy to owls or do u rape owls or are you an owl who is a rapist,22/5/2022 15:38,VinodKS_Pax,/r/SingaporeRaw/comments/uur306/beware_of_leejunwei/i9ko1vd/,t3_uur306,t1_i9h96gz,i9ko1vd,t5_xnx04,"{'controversiality': 0, 'collapsed_reason_code': None, 'collapsed': False, 'collapsed_reason': None}",2022,20,No,Toxic 3,give therapy owls u rape owls owl rapist,-1,"singapores, malaysians, chinese, malaysian",1.0,Race,0.0,beware of leejunwei
"can incite anger, violence and hatred against each other and to the establishment Did these motherfuckers just try to threaten us",27/7/2021 10:01,ham_rain,/r/singapore/comments/osjsyy/chan_chun_sing_mumbling_xiasuay_in_the_background/h6ouwqf/,t3_osjsyy,t3_osjsyy,h6ouwqf,t5_2qh8c,"{'collapsed_reason_code': None, 'collapsed_reason': None, 'collapsed': False, 'controversiality': 0}",2021,21,No,Toxic 3,incite anger violence hatred establishment motherfuckers try threaten us,-1,"singapores, malaysians, chinese, malaysian",1.0,Race,0.0,chan chun sing mumbling xiasuay in the background
"I think when Im 35 and enjoyed what I want in life, I should just kill myself instead of dealing with this shit.",29/9/2021 4:39,DanceAlien,/r/singapore/comments/px7fqb/singapores_firsttime_homebuyers_in_a_bind_as/heoq4zl/,t3_px7fqb,t3_px7fqb,heoq4zl,t5_2qh8c,"{'collapsed_reason_code': None, 'collapsed_reason': None, 'collapsed': False, 'controversiality': 0}",2021,23,No,Toxic 3,think im 35 enjoyed want life kill instead dealing,-1,"singapores, malaysians, chinese, malaysian",1.0,Race,0.0,singapores firsttime homebuyers in a bind as
ice block rubber hose hammer n telephone book until confess voluntarily,8/21/2021 9:42,Strong_Guidance_6437,/r/singapore/comments/p8o99p/do_prc_chinese_and_malaysian_chinese_think_of/h9rsukm/,t3_p8o99p,t1_h9rrks2,h9rsukm,t5_2qh8c,"{'collapsed_reason_code': None, 'collapsed_reason': None, 'collapsed': False, 'controversiality': 0}",2021,11,No,Toxic 3,ice block rubber hose hammer n telephone book confess voluntarily,-1,"singapores, malaysians, chinese, malaysian",1.0,Race,0.0,do prc chinese and malaysian chinese think of
Bill gates is onto something when he joked that those 61k idiots should be caned and put on a leash. Would pay money to watch those burdens getting whipped publicly,18/11/2021 16:40,ChaosDC,/r/singapore/comments/qwpbbo/pm_lee_explains_singapores_ease_up_stabilise/hl4zq81/,t3_qwpbbo,t3_qwpbbo,hl4zq81,t5_2qh8c,"{'collapsed_reason_code': None, 'collapsed_reason': None, 'collapsed': False, 'controversiality': 1}",2021,30,No,Toxic 3,bill gates onto something joked 61k idiots caned put leash would pay money watch burdens getting whipped publicly,-1,"singapores, malaysians, chinese, malaysian",1.0,Race,0.0,pm lee explains singapores ease up stabilise
What a good little slut,12/16/2022 20:44,noway2yesway,/r/SingaporeRaw/comments/znoiri/sexy_christina_loh_01/j0i6nw3/,t3_znoiri,t3_znoiri,j0i6nw3,t5_xnx04,"{'controversiality': 0, 'collapsed_reason_code': None, 'collapsed': False, 'collapsed_reason': None}",2022,5,No,Toxic 2,good little slut,-1,"singapores, malaysians, chinese, malaysian",1.0,Race,0.0,sexy christina loh 01
You sound really low class and uneducated. Get off reddit and go back to your echo chamber like hardwarezone or something.,25/9/2021 6:40,medium_rare_only,/r/SingaporeRaw/comments/puwh1o/song_boh/he6xj46/,t3_puwh1o,t3_puwh1o,he6xj46,t5_xnx04,"{'collapsed_reason_code': None, 'collapsed_reason': None, 'collapsed': False, 'controversiality': 0}",2021,21,No,Toxic 2,sound really low class uneducated get reddit go back echo chamber like hardwarezone something,-1,"singapores, malaysians, chinese, malaysian",1.0,Race,0.0,song boh
"Wonderful, idiot in red with 11 packs of toilet rolls, 3 Cif, 10 boxes of tissue. Gonna do some preCNY housekeeping. Along with a carton box of rice bran oil. Way to go genius, amongst other geniuses.",14/5/2021 8:21,the_cow_unicorn,/r/singapore/comments/nc2fe6/kiasu_singaporeans_rushing_to_the_supermarket/gy2so36/,t3_nc2fe6,t3_nc2fe6,gy2so36,t5_2qh8c,"{'collapsed_reason': None, 'author_is_blocked': False, 'collapsed_reason_code': None, 'collapsed': False, 'controversiality': 0}",2021,37,No,Toxic 2,wonderful idiot red 11 packs toilet rolls 3 cif 10 boxes tissue gonna precny housekeeping along carton box rice bran oil way go genius amongst geniuses,-1,"singapores, malaysians, chinese, malaysian",1.0,Race,0.0,kiasu singaporeans rushing to the supermarket
"pretty sure some people out there can remove your skin, but you'll have other problems worse than feeling hot then",5/5/2022 3:03,nekosake2,/r/singapore/comments/uhxaw0/many_miles_to_go_in_singapores_carlite_journey/i7dpgd3/,t3_uhxaw0,t1_i7a4qvk,i7dpgd3,t5_2qh8c,"{'controversiality': 0, 'collapsed_reason_code': None, 'collapsed': False, 'collapsed_reason': None}",2022,20,No,Toxic 2,pretty sure people remove skin youll problems worse feeling hot,-1,"singapores, malaysians, chinese, malaysian",1.0,Race,0.0,many miles to go in singapores carlite journey
Good times make weak men like u,11/1/2021 1:51,FocusOnThePOCUS,/r/singapore/comments/qj3374/we_interviewed_singaporean_footballer_harry/hiu4mo8/,t3_qj3374,t1_hitxt64,hiu4mo8,t5_2qh8c,"{'collapsed_reason_code': None, 'collapsed_reason': None, 'collapsed': False, 'controversiality': 0}",2021,7,No,Toxic 2,good times make weak men like u,-1,"singapores, malaysians, chinese, malaysian",1.0,Race,0.0,we interviewed singaporean footballer harry
"Win liao, face like that can plan his own harem. Must be amazing at being a manipulator.",26/9/2021 9:42,Farquadthefirst,/r/singapore/comments/pvogmt/booksactuallys_kenny_leck_under_fire_after_female/hebu1wg/,t3_pvogmt,t3_pvogmt,hebu1wg,t5_2qh8c,"{'collapsed_reason_code': None, 'collapsed_reason': None, 'collapsed': False, 'controversiality': 0}",2021,17,No,Toxic 2,win already face like plan harem must amazing manipulator,-1,"singapores, malaysians, chinese, malaysian",1.0,Race,0.0,booksactuallys kenny leck under fire after female
Camera focus is a little off... looks like you got yourself a blur cock.,11/4/2021 1:02,hucks22,/r/singapore/comments/mogt6j/cock_spotted_at_sengkang/gu3o6nx/,t3_mogt6j,t3_mogt6j,gu3o6nx,t5_2qh8c,"{'collapsed_reason': None, 'author_is_blocked': False, 'collapsed_reason_code': None, 'collapsed': False, 'controversiality': 0}",2021,14,No,Toxic 2,camera focus little looks like got blur cock,-1,"singapores, malaysians, chinese, malaysian",1.0,Race,0.0,cock spotted at sengkang
Inb4 another lockdown again. Praise be Dr. Lawrence WRONG! Not forgetting about pedo Epstein Island Bill Gates and our beloved Founder of cience HeHim Dr Anthony Fauci,20/5/2022 15:41,greyamoon,/r/SingaporeRaw/comments/utyi8e/a_beautiful_sunset_at_marina_bay_sands/i9cb3g9/,t3_utyi8e,t3_utyi8e,i9cb3g9,t5_xnx04,"{'controversiality': 0, 'collapsed_reason_code': None, 'collapsed': False, 'collapsed_reason': None}",2022,27,No,Toxic 2,inb4 another lockdown praise dr lawrence wrong forgetting pedo epstein island bill gates beloved founder cience hehim dr anthony fauci,-1,"singapores, malaysians, chinese, malaysian",1.0,Race,0.0,a beautiful sunset at marina bay sands
